{
  "$schema": "../../../schema/service.schema.json",
  "slug": "cold-water-meter-verification",
  "title": "Повірка лічильника ХВП",
  "direction": "metering-and-comfort",
  "showPrice": false,
  "status": "consult",
  "shortDescription": "Перевіримо лічильник холодної води без демонтажу або в лабораторії та оформимо результат процедури.",
  "description": "Під час повірки визначається, чи вкладається похибка лічильника холодної води в допустимі межі. Якщо конфігурація вузла дозволяє, майстер використовує переносну установку без зняття приладу. В інших випадках лічильник демонтують і перевіряють у стаціонарних умовах. Формат робіт погоджується після огляду або консультації.",
  "includes": [
    "перевірка стану та показників лічильника",
    "підключення повірочної установки",
    "контроль точності на кількох режимах витрати",
    "оформлення результату повірки"
  ],
  "duration": "залежить від способу повірки",
  "image": "/images/services/cold-water-meter-verification-v2.webp",
  "featured": false,
  "source": "manual"
}
