{
  "$schema": "../../../schema/service.schema.json",
  "slug": "energy-equipment-warranty-service",
  "title": "Гарантійний і післягарантійний сервіс енергетичного обладнання",
  "direction": "energy-solutions",
  "showPrice": false,
  "status": "consult",
  "shortDescription": "Перевіримо параметри системи, виявимо відхилення, виконаємо регламентні роботи та підготуємо рекомендації.",
  "description": "Сервісне обслуговування спрямоване на стабільну й безпечну роботу обладнання протягом усього строку експлуатації. Перевіряємо фактичні параметри, стан з’єднань, налаштування, журнали подій і доступні дані моніторингу. За результатами огляду фіксуємо відхилення, визначаємо пріоритетність робіт і погоджуємо ремонт, заміну компонентів або коригування режимів.",
  "includes": [
    "дистанційна діагностика або виїзний технічний огляд",
    "перевірка параметрів, з’єднань, захистів і налаштувань",
    "регламентні роботи, локалізація та усунення несправностей",
    "звіт про стан системи й рекомендації щодо подальшої експлуатації"
  ],
  "duration": "формат і строк залежать від стану та типу обладнання",
  "image": "/images/services/energy-equipment-service.webp",
  "featured": false,
  "source": "manual"
}
