{
  "$schema": "../../../schema/service.schema.json",
  "slug": "electrical-commissioning-integration",
  "title": "Електромонтажні, пусконалагоджувальні та інтеграційні роботи",
  "direction": "energy-solutions",
  "showPrice": false,
  "status": "consult",
  "shortDescription": "Під’єднаємо компоненти, налаштуємо захисти й автоматику та перевіримо спільну роботу всієї системи.",
  "description": "Виконуємо силові й слабкострумові підключення, збираємо щити, прокладаємо кабельні лінії та інтегруємо нове обладнання з наявною мережею об’єкта. Під час пусконалагодження перевіряємо послідовність фаз, параметри захисту, зв’язок між компонентами та роботу в основних і аварійних режимах. Завдання етапу — не лише ввімкнути окремі пристрої, а підтвердити коректну взаємодію системи як цілого.",
  "includes": [
    "монтаж щитів, кабельних мереж, захисту й комунікацій",
    "підключення обладнання до мережі та суміжних систем",
    "налаштування параметрів, автоматики й обміну даними",
    "функціональні випробування та фіксація результатів запуску"
  ],
  "duration": "визначається схемою підключення та обсягом інтеграції",
  "image": "/images/services/electrical-commissioning-integration.webp",
  "featured": false,
  "source": "manual"
}
