{
  "$schema": "../../../schema/service.schema.json",
  "slug": "plumbing-works",
  "title": "Різні сантехнічні роботи",
  "direction": "metering-and-comfort",
  "showPrice": false,
  "status": "consult",
  "shortDescription": "Виконаємо ремонт і монтаж водопроводу, арматури, сифонів, змішувачів та інших сантехнічних вузлів.",
  "description": "Допомагаємо з побутовими та супутніми сантехнічними роботами: заміною кранів і клапанів, підключенням сантехніки, ремонтом доступних ділянок трубопроводу, усуненням протікань і впорядкуванням вузлів водопостачання. Точний обсяг визначається після опису проблеми, фото або огляду майстром.",
  "includes": [
    "попередня консультація за описом або фото",
    "діагностика несправності на місці",
    "заміна арматури чи ремонт доступного вузла",
    "перевірка з’єднань після виконання робіт"
  ],
  "duration": "визначається після оцінки завдання",
  "image": "/images/services/plumbing-works-v3.webp",
  "featured": false,
  "source": "manual"
}
