{
  "$schema": "../../../schema/service.schema.json",
  "slug": "battery-replacement-onsite",
  "title": "Заміна батарейки на місці експлуатації з виїздом спеціаліста",
  "direction": "metering-and-comfort",
  "showPrice": false,
  "status": "consult",
  "shortDescription": "Майстер приїде до об’єкта, перевірить живлення й замінить батарейку без перевезення лічильника до сервісу.",
  "description": "Виїзна заміна зручна, коли теплолічильник змонтований у квартирному або будинковому вузлі й демонтаж небажаний. Перед візитом уточнюємо модель приладу та виконання батарейки. На об’єкті спеціаліст фіксує показники, перевіряє стан живлення, встановлює сумісний елемент і тестує відображення даних. Якщо корпус або батарейний відсік опломбований, розпломбування необхідно заздалегідь погодити з постачальником тепла.",
  "includes": [
    "попередній підбір батарейки за моделлю або фото",
    "виїзд спеціаліста у погоджений час",
    "фіксація показників і перевірка живлення",
    "заміна батарейки та контроль роботи приладу"
  ],
  "duration": "орієнтовно 30–90 хв на об’єкті",
  "image": "/images/services/generated-archive/battery-replacement-onsite.webp",
  "featured": true,
  "source": "manual"
}
