{
  "$schema": "../../../schema/service.schema.json",
  "slug": "turnkey-solar-power-plants",
  "title": "Будівництво сонячних електростанцій під ключ",
  "direction": "energy-solutions",
  "showPrice": false,
  "status": "consult",
  "shortDescription": "Реалізуємо СЕС повним циклом: від обстеження й проєкту до монтажу, запуску та навчання користувача.",
  "description": "Будівництво сонячної електростанції під ключ об’єднує всі етапи в одному керованому проєкті. Оцінюємо споживання, доступну площу, затінення та умови приєднання, розробляємо конфігурацію й документацію, комплектуємо об’єкт і виконуємо монтаж. Після електротехнічних перевірок налаштовуємо обладнання, підключаємо моніторинг і передаємо замовнику готову до експлуатації систему.",
  "includes": [
    "обстеження об’єкта та оцінка потенціалу розміщення",
    "проєктування, комплектація й організація постачання",
    "монтаж фотомодулів, інверторів, захисту та кабельних мереж",
    "пусконалагодження, моніторинг і передача системи в роботу"
  ],
  "duration": "визначається після обстеження та проєктування",
  "image": "/images/services/turnkey-solar-power-plant.webp",
  "featured": true,
  "source": "manual"
}
