{
  "$schema": "../../../schema/service.schema.json",
  "slug": "hot-water-meter-installation-replacement",
  "title": "Встановлення і заміна лічильника ГВП",
  "direction": "metering-and-comfort",
  "showPrice": false,
  "status": "consult",
  "shortDescription": "Встановимо або замінимо лічильник гарячої води з новими ущільненнями та перевіркою герметичності.",
  "description": "Перед встановленням перевіряємо стан запірної арматури, напрямок потоку, монтажну довжину та доступ до вузла. Старий прилад демонтуємо після перекриття води, новий лічильник гарячої води встановлюємо з відповідними ущільненнями та з’єднаннями. Після подачі води контролюємо герметичність і коректну роботу рахункового механізму.",
  "includes": [
    "огляд вузла та перевірка запірних кранів",
    "демонтаж старого приладу за потреби",
    "монтаж лічильника й нових ущільнень",
    "перевірка герметичності та обертання механізму"
  ],
  "duration": "орієнтовно 1–2 години за справного вузла",
  "image": "/images/services/hot-water-meter-installation-v5.webp",
  "featured": false,
  "source": "manual"
}
