{
  "$schema": "../../../schema/service.schema.json",
  "slug": "hot-water-meter-verification",
  "title": "Повірка лічильника ГВП",
  "direction": "metering-and-comfort",
  "showPrice": false,
  "status": "consult",
  "shortDescription": "Перевіримо точність лічильника гарячої води на місці або з демонтажем та підготуємо результати повірки.",
  "description": "Повірка лічильника гарячої води потрібна для підтвердження точності вимірювань і подальшого коректного обліку. Залежно від доступу до вузла та типу приладу перевірка виконується переносною установкою без демонтажу або після зняття лічильника. Після завершення клієнт отримує належно оформлений результат для подальшої реєстрації у постачальника.",
  "includes": [
    "огляд приладу та перевірка доступу",
    "контроль точності вимірювання витрати",
    "повірка без демонтажу або зі зняттям",
    "оформлення результату повірки"
  ],
  "duration": "залежить від способу повірки",
  "image": "/images/services/hot-water-meter-verification-v2.webp",
  "featured": false,
  "source": "manual"
}
