{
  "$schema": "../../../schema/service.schema.json",
  "slug": "boiler-installation-replacement",
  "title": "Встановлення і заміна водонагрівача (бойлера)",
  "direction": "metering-and-comfort",
  "showPrice": false,
  "status": "consult",
  "shortDescription": "Встановимо новий бойлер або замінимо старий, підключимо водопостачання та перевіримо безпечну роботу.",
  "description": "Перед монтажем оцінюємо місце, міцність основи, розташування комунікацій і параметри водонагрівача. Після демонтажу старого обладнання або підготовки кріплень встановлюємо бойлер, монтуємо запірну арматуру та групу безпеки, під’єднуємо воду й перевіряємо герметичність. Електричне підключення має відповідати вимогам виробника та захисту мережі.",
  "includes": [
    "огляд місця та перевірка комплектності",
    "демонтаж старого бойлера за потреби",
    "монтаж кріплень, арматури й підключень",
    "заповнення, перевірка герметичності та запуск"
  ],
  "duration": "від кількох годин залежно від підготовки місця",
  "image": "/images/services/boiler-installation-v3.webp",
  "featured": false,
  "source": "manual"
}
